{
  "_synthetic": true,
  "_notice": "SYNTHETIC DATA — fictional persons, generated for the Quantic AI Engineering project. No real employee information.",
  "_generator": "scripts/gen_mock_data.py seed=1729",
  "as_of": "2026-09-01",
  "records": [
    {
      "employee_id": "E1002",
      "plan_year": 2026,
      "as_of": "2026-09-01",
      "waiting_period_ends": "2019-09-15",
      "eligibility_reason": "Eligible since 2019-09-15 (90-day new-hire waiting period complete)",
      "elections": [
        {
          "plan_type": "medical",
          "plan_id": "MED-PPO-1500",
          "plan_name": "MosaicCare PPO 1500",
          "tier": "family",
          "effective_date": "2026-01-01",
          "employee_cost_monthly": 398.0
        },
        {
          "plan_type": "dental",
          "plan_id": "DEN-STD",
          "plan_name": "MosaicSmile Standard Dental",
          "tier": "family",
          "effective_date": "2026-01-01",
          "employee_cost_monthly": 38.0
        },
        {
          "plan_type": "vision",
          "plan_id": "VIS-STD",
          "plan_name": "MosaicView Standard Vision",
          "tier": "family",
          "effective_date": "2026-01-01",
          "employee_cost_monthly": 16.0
        },
        {
          "plan_type": "life",
          "plan_id": "LIFE-BASIC",
          "plan_name": "Basic Life & AD&D (company paid)",
          "tier": "employee_only",
          "effective_date": "2026-01-01",
          "employee_cost_monthly": 0.0
        },
        {
          "plan_type": "retirement_401k",
          "plan_id": "RET-401K",
          "plan_name": "MosaicOne 401(k)",
          "tier": "employee_only",
          "effective_date": "2026-01-01",
          "employee_cost_monthly": 0.0
        },
        {
          "plan_type": "fsa",
          "plan_id": "FSA-HC",
          "plan_name": "MosaicSave Health Care FSA",
          "tier": "employee_only",
          "effective_date": "2026-01-01",
          "employee_cost_monthly": 0.0
        }
      ],
      "dependents": 1,
      "open_enrollment_window": {
        "open": "2026-11-01",
        "close": "2026-11-21"
      }
    },
    {
      "employee_id": "E1003",
      "plan_year": 2026,
      "as_of": "2026-09-01",
      "waiting_period_ends": "2018-06-03",
      "eligibility_reason": "Eligible since 2018-06-03 (90-day new-hire waiting period complete)",
      "elections": [
        {
          "plan_type": "medical",
          "plan_id": "MED-HDHP-3000",
          "plan_name": "MosaicCare HDHP 3000",
          "tier": "employee_children",
          "effective_date": "2026-01-01",
          "employee_cost_monthly": 144.0
        },
        {
          "plan_type": "dental",
          "plan_id": "DEN-STD",
          "plan_name": "MosaicSmile Standard Dental",
          "tier": "employee_children",
          "effective_date": "2026-01-01",
          "employee_cost_monthly": 24.0
        },
        {
          "plan_type": "vision",
          "plan_id": "VIS-STD",
          "plan_name": "MosaicView Standard Vision",
          "tier": "employee_children",
          "effective_date": "2026-01-01",
          "employee_cost_monthly": 10.0
        },
        {
          "plan_type": "life",
          "plan_id": "LIFE-BASIC",
          "plan_name": "Basic Life & AD&D (company paid)",
          "tier": "employee_only",
          "effective_date": "2026-01-01",
          "employee_cost_monthly": 0.0
        },
        {
          "plan_type": "retirement_401k",
          "plan_id": "RET-401K",
          "plan_name": "MosaicOne 401(k)",
          "tier": "employee_only",
          "effective_date": "2026-01-01",
          "employee_cost_monthly": 0.0
        },
        {
          "plan_type": "hsa",
          "plan_id": "HSA-STD",
          "plan_name": "MosaicSave Health Savings Account",
          "tier": "employee_only",
          "effective_date": "2026-01-01",
          "employee_cost_monthly": 0.0
        }
      ],
      "dependents": 1,
      "open_enrollment_window": {
        "open": "2026-11-01",
        "close": "2026-11-21"
      }
    },
    {
      "employee_id": "E1007",
      "plan_year": 2026,
      "as_of": "2026-09-01",
      "waiting_period_ends": "2020-05-24",
      "eligibility_reason": "Eligible since 2020-05-24 (90-day new-hire waiting period complete)",
      "elections": [
        {
          "plan_type": "medical",
          "plan_id": "MED-PPO-1500",
          "plan_name": "MosaicCare PPO 1500",
          "tier": "employee_spouse",
          "effective_date": "2026-01-01",
          "employee_cost_monthly": 286.0
        },
        {
          "plan_type": "dental",
          "plan_id": "DEN-STD",
          "plan_name": "MosaicSmile Standard Dental",
          "tier": "employee_spouse",
          "effective_date": "2026-01-01",
          "employee_cost_monthly": 26.0
        },
        {
          "plan_type": "vision",
          "plan_id": "VIS-STD",
          "plan_name": "MosaicView Standard Vision",
          "tier": "employee_spouse",
          "effective_date": "2026-01-01",
          "employee_cost_monthly": 11.0
        },
        {
          "plan_type": "life",
          "plan_id": "LIFE-BASIC",
          "plan_name": "Basic Life & AD&D (company paid)",
          "tier": "employee_only",
          "effective_date": "2026-01-01",
          "employee_cost_monthly": 0.0
        },
        {
          "plan_type": "retirement_401k",
          "plan_id": "RET-401K",
          "plan_name": "MosaicOne 401(k)",
          "tier": "employee_only",
          "effective_date": "2026-01-01",
          "employee_cost_monthly": 0.0
        },
        {
          "plan_type": "fsa",
          "plan_id": "FSA-HC",
          "plan_name": "MosaicSave Health Care FSA",
          "tier": "employee_only",
          "effective_date": "2026-01-01",
          "employee_cost_monthly": 0.0
        }
      ],
      "dependents": 1,
      "open_enrollment_window": {
        "open": "2026-11-01",
        "close": "2026-11-21"
      }
    },
    {
      "employee_id": "E1014",
      "plan_year": 2026,
      "as_of": "2026-09-01",
      "waiting_period_ends": "2019-12-01",
      "eligibility_reason": "Eligible since 2019-12-01 (90-day new-hire waiting period complete)",
      "elections": [
        {
          "plan_type": "medical",
          "plan_id": "MED-PPO-1500",
          "plan_name": "MosaicCare PPO 1500",
          "tier": "employee_children",
          "effective_date": "2026-01-01",
          "employee_cost_monthly": 262.0
        },
        {
          "plan_type": "dental",
          "plan_id": "DEN-STD",
          "plan_name": "MosaicSmile Standard Dental",
          "tier": "employee_children",
          "effective_date": "2026-01-01",
          "employee_cost_monthly": 24.0
        },
        {
          "plan_type": "vision",
          "plan_id": "VIS-STD",
          "plan_name": "MosaicView Standard Vision",
          "tier": "employee_children",
          "effective_date": "2026-01-01",
          "employee_cost_monthly": 10.0
        },
        {
          "plan_type": "life",
          "plan_id": "LIFE-BASIC",
          "plan_name": "Basic Life & AD&D (company paid)",
          "tier": "employee_only",
          "effective_date": "2026-01-01",
          "employee_cost_monthly": 0.0
        },
        {
          "plan_type": "retirement_401k",
          "plan_id": "RET-401K",
          "plan_name": "MosaicOne 401(k)",
          "tier": "employee_only",
          "effective_date": "2026-01-01",
          "employee_cost_monthly": 0.0
        },
        {
          "plan_type": "fsa",
          "plan_id": "FSA-HC",
          "plan_name": "MosaicSave Health Care FSA",
          "tier": "employee_only",
          "effective_date": "2026-01-01",
          "employee_cost_monthly": 0.0
        }
      ],
      "dependents": 1,
      "open_enrollment_window": {
        "open": "2026-11-01",
        "close": "2026-11-21"
      }
    },
    {
      "employee_id": "E1017",
      "plan_year": 2026,
      "as_of": "2026-09-01",
      "waiting_period_ends": "2020-10-11",
      "eligibility_reason": "Eligible since 2020-10-11 (90-day new-hire waiting period complete)",
      "elections": [
        {
          "plan_type": "medical",
          "plan_id": "MED-PPO-1500",
          "plan_name": "MosaicCare PPO 1500",
          "tier": "employee_only",
          "effective_date": "2026-01-01",
          "employee_cost_monthly": 142.0
        },
        {
          "plan_type": "dental",
          "plan_id": "DEN-STD",
          "plan_name": "MosaicSmile Standard Dental",
          "tier": "employee_only",
          "effective_date": "2026-01-01",
          "employee_cost_monthly": 14.0
        },
        {
          "plan_type": "vision",
          "plan_id": "VIS-STD",
          "plan_name": "MosaicView Standard Vision",
          "tier": "employee_only",
          "effective_date": "2026-01-01",
          "employee_cost_monthly": 6.0
        },
        {
          "plan_type": "life",
          "plan_id": "LIFE-BASIC",
          "plan_name": "Basic Life & AD&D (company paid)",
          "tier": "employee_only",
          "effective_date": "2026-01-01",
          "employee_cost_monthly": 0.0
        },
        {
          "plan_type": "retirement_401k",
          "plan_id": "RET-401K",
          "plan_name": "MosaicOne 401(k)",
          "tier": "employee_only",
          "effective_date": "2026-01-01",
          "employee_cost_monthly": 0.0
        },
        {
          "plan_type": "fsa",
          "plan_id": "FSA-HC",
          "plan_name": "MosaicSave Health Care FSA",
          "tier": "employee_only",
          "effective_date": "2026-01-01",
          "employee_cost_monthly": 0.0
        }
      ],
      "dependents": 0,
      "open_enrollment_window": {
        "open": "2026-11-01",
        "close": "2026-11-21"
      }
    },
    {
      "employee_id": "E1042",
      "plan_year": 2026,